<?xml version="1.0" encoding="UTF-8"?>
<xs:schema xmlns:xs="http://www.w3.org/2001/XMLSchema">
	<xs:element name="book" type="bookType"/>
	<xs:element name="name" type="xs:string"/>
	<xs:complexType name="bookType">
		<xs:sequence>
			<xs:element name="isb" type="xs:string"/>
			<xs:element name="title" type="xs:string"/>
			<xs:element name="category" type="categoryType"/>
			<xs:element name="author" type="authorType"/>
			<xs:element name="publisher" type="publisherType"/>
		</xs:sequence>
	</xs:complexType>
	<xs:complexType name="authorType">
		<xs:sequence>
			<xs:element ref="name"/>
			<xs:element name="dob" type="xs:date"/>
		</xs:sequence>
	</xs:complexType>
	<xs:complexType name="publisherType">
		<xs:sequence>
			<xs:element ref="name"/>
			<xs:element name="est-dt" type="xs:date"/>
		</xs:sequence>
	</xs:complexType>
	<xs:simpleType name="categoryType">
		<xs:restriction base="xs:string">
			<xs:enumeration value="Fiction"/>
			<xs:enumeration value="Kids"/>
			<xs:enumeration value="Drama"/>
		</xs:restriction>	
	</xs:simpleType>
</xs:schema>














